outputs/step06_permutation_importance.csv

feature,importance_mean,importance_std
term,0.07422557028297251,0.003307107216609969
annual_inc,0.025841575886973656,0.002668526827746404
dti,0.016516836979885728,0.0018309683477808006
revol_util,0.008031139963604028,0.0027510679916009583
tot_cur_bal,0.007070979702163305,0.0018972012822968535
home_ownership,0.006069949352982895,0.0009818785049354594
total_acc,0.0023186023324974435,0.000752886406743395
total_rev_hi_lim,0.0022546015256459497,0.0006152184867181608
verification_status,0.0021263433596724777,0.0035218044048083664
inq_last_6mths,0.0017214322007462423,0.0009571745842834053
open_acc,0.0012277971349994644,0.0007597555179676982
mths_since_last_record,0.0010265564724488362,0.00018720196741222
purpose,0.0009775147555371566,0.0006111872425668089
addr_state,0.000905760617340956,0.0006322322469866347
loan_amnt,0.0008369499638371858,0.0014971453282292978
mths_since_last_delinq,0.0006825640702064039,0.00041112142727318235
pub_rec,0.0005019437555532136,7.03896060652203e-05
emp_length,0.00042383689225340416,0.0006857134137450154
delinq_2yrs,0.0002817523857970627,0.00012869214439965884
tot_coll_amt,7.810605753939548e-05,0.0005566723357852729
earliest_cr_line,0.0,0.0
acc_now_delinq,0.0,0.0
application_type,0.0,0.0
collections_12_mths_ex_med,-1.977575051215208e-06,1.340531479206311e-06
mths_since_last_major_derog,-0.00013752303970949732,0.00020566947497227797
initial_list_status,-0.0006408389401740156,0.00045922734780945017
revol_bal,-0.0007409795252691475,0.0007009833147964477

README.md

## Model Interpretation

- term: 0.07423
- annual_inc: 0.02584
- dti: 0.01652
- revol_util: 0.00803
- tot_cur_bal: 0.00707